{
  "schema_version": 2,
  "runtime": "hermes",
  "display_name": "Hermes Agent",
  "support_tier": "experimental",
  "support_summary": "Deterministic adapter and kernel conformance; installed-client model inference remains unverified, with advisory hooks and separate native memory",
  "components": ["core", "portable-skills", "agents-instructions", "hermes-adapter"],
  "install": {
    "mode": "skill-copy-or-external-directory",
    "next_steps": [
      "Expose this repository's .agents/skills directory to Hermes or install all four short aliases and their context-* cores.",
      "Start a new Hermes session so the installed skill catalog refreshes.",
      "Keep Hermes MEMORY.md and USER.md separate from repository state."
    ]
  },
  "onboarding_doc": "adapters/hermes/README.md",
  "surfaces": {
    "cli": {
      "kind": "cli",
      "support_tier": "experimental",
      "instruction_sources": [
        {"scope": "repository", "role": "canonical", "path": "AGENTS.md", "precedence": 100}
      ],
      "skill_sources": [
        {"scope": "repository", "role": "skills", "path": ".agents/skills", "precedence": 100},
        {"scope": "repository", "role": "additive", "path": "adapters/hermes", "precedence": 90}
      ],
      "invocation": {"setup": "/context-setup", "start": "/context-start", "update": "/context-update", "end": "/context-end"},
      "capabilities": {
        "agent_skills": "adapter",
        "explicit_invocation": "advisory",
        "project_hooks": "adapter",
        "blocking_pre_tool_hook": "advisory",
        "mcp": "native",
        "native_memory": "native",
        "proposal_apply": "adapter",
        "skill_allowlists": "unsupported",
        "execution_authorization": "unsupported"
      },
      "hook_output": "allow-message",
      "binary_probes": [
        {"purpose": "availability", "candidates": ["hermes"]},
        {"purpose": "version", "candidates": ["hermes"]}
      ],
      "conformance_tests": [
        "tests/test_contextos_kernel.py",
        "tests/test_cross_runtime_hooks.py",
        "tests/test_runtime_conformance.py"
      ],
      "evidence": [
        "hermes-overview", "hermes-hooks", "hermes-kernel",
        "hermes-hook-conformance", "hermes-conformance"
      ]
    }
  },
  "evidence": {
    "checked_on": "2026-08-24",
    "tested_versions": [],
    "sources": [
      {
        "id": "hermes-overview",
        "type": "official",
        "location": "https://github.com/NousResearch/hermes-agent/blob/main/website/docs/user-guide/features/overview.md",
        "claims": ["mcp", "native_memory", "invocation", "instruction_sources", "skill_sources"]
      },
      {
        "id": "hermes-hooks",
        "type": "official",
        "location": "https://github.com/NousResearch/hermes-agent/blob/main/website/docs/user-guide/features/hooks.md",
        "claims": ["hook_output"]
      },
      {
        "id": "hermes-kernel",
        "type": "conformance",
        "location": "tests/test_contextos_kernel.py",
        "claims": ["proposal_apply"]
      },
      {
        "id": "hermes-hook-conformance",
        "type": "conformance",
        "location": "tests/test_cross_runtime_hooks.py",
        "claims": ["project_hooks", "blocking_pre_tool_hook"]
      },
      {
        "id": "hermes-conformance",
        "type": "conformance",
        "location": "tests/test_runtime_conformance.py",
        "claims": ["agent_skills", "explicit_invocation", "support"]
      }
    ]
  }
}
