{
  "schema_version": 2,
  "runtime": "openclaw",
  "display_name": "OpenClaw",
  "support_tier": "first-class",
  "support_summary": "External-plugin lifecycle support with alias-bound subagent cwd, copied portable skills, separate private memory, and deterministic digest apply",
  "components": ["core", "portable-skills", "agents-instructions", "openclaw-adapter"],
  "install": {
    "mode": "skill-copy-to-private-workspace",
    "next_steps": [
      "Create or choose a private OpenClaw workspace outside this repository.",
      "Run python adapters/openclaw/sync_skills.py sync --workspace <private-workspace> from the exact repository commit you intend to use, then verify it with the check command.",
      "Package and install adapters/openclaw/plugin from the exact reviewed commit, then bind a project alias to absolute root and bashPath values in plugins.entries.context-os.config.",
      "Invoke /contextos <alias> setup, start, update, or end as an authorized operator, or use the operator-scoped contextos.run, contextos.wait, and contextos.result Gateway methods. Apply only an exact reviewed digest through /contextos <alias> apply <digest> or contextos.apply."
    ]
  },
  "onboarding_doc": "adapters/openclaw/README.md",
  "surfaces": {
    "cli": {
      "kind": "cli",
      "support_tier": "first-class",
      "instruction_sources": [
        {"scope": "repository", "role": "canonical", "path": "AGENTS.md", "precedence": 100},
        {"scope": "workspace", "role": "persona", "path": "SOUL.md", "precedence": 90},
        {"scope": "workspace", "role": "persona", "path": "USER.md", "precedence": 80},
        {"scope": "workspace", "role": "memory", "path": "MEMORY.md", "precedence": 70}
      ],
      "skill_sources": [
        {"scope": "workspace", "role": "skills", "path": "skills", "precedence": 100},
        {"scope": "workspace", "role": "skills", "path": ".agents/skills", "precedence": 90}
      ],
      "invocation": {
        "setup": "/contextos <alias> setup",
        "start": "/contextos <alias> start",
        "update": "/contextos <alias> update",
        "end": "/contextos <alias> end"
      },
      "capabilities": {
        "agent_skills": "native",
        "explicit_invocation": "adapter",
        "project_hooks": "unsupported",
        "blocking_pre_tool_hook": "unsupported",
        "mcp": "native",
        "native_memory": "native",
        "proposal_apply": "adapter",
        "skill_allowlists": "native",
        "execution_authorization": "native"
      },
      "hook_output": null,
      "binary_probes": [
        {"purpose": "availability", "candidates": ["openclaw"]},
        {"purpose": "version", "candidates": ["openclaw"]},
        {"purpose": "native-doctor", "candidates": ["openclaw"]}
      ],
      "conformance_tests": [
        "tests/test_openclaw_conformance.py",
        "tests/test_openclaw_live_harness.py",
        "adapters/openclaw/plugin/plugin.test.mjs",
        "tests/test_contextos_kernel.py"
      ],
      "evidence": [
        "openclaw-skills",
        "openclaw-workspace",
        "openclaw-system-prompt",
        "openclaw-exec-approvals",
        "openclaw-doctor",
        "openclaw-mcp",
        "openclaw-plugin-conformance",
        "openclaw-kernel",
        "openclaw-conformance"
      ]
    }
  },
  "evidence": {
    "checked_on": "2026-08-28",
    "tested_versions": [
      {"surface": "cli", "version": "OpenClaw 2026.7.1-2 (0790d9f)"}
    ],
    "sources": [
      {
        "id": "openclaw-skills",
        "type": "official",
        "location": "https://docs.openclaw.ai/tools/skills",
        "claims": ["agent_skills", "explicit_invocation", "skill_allowlists", "skill_sources", "invocation"]
      },
      {
        "id": "openclaw-workspace",
        "type": "official",
        "location": "https://docs.openclaw.ai/agent-workspace",
        "claims": ["native_memory", "instruction_sources"]
      },
      {
        "id": "openclaw-system-prompt",
        "type": "official",
        "location": "https://docs.openclaw.ai/concepts/system-prompt",
        "claims": ["instruction_sources"]
      },
      {
        "id": "openclaw-exec-approvals",
        "type": "official",
        "location": "https://docs.openclaw.ai/tools/exec-approvals",
        "claims": ["execution_authorization"]
      },
      {
        "id": "openclaw-doctor",
        "type": "official",
        "location": "https://docs.openclaw.ai/cli/doctor",
        "claims": ["support"]
      },
      {
        "id": "openclaw-mcp",
        "type": "official",
        "location": "https://docs.openclaw.ai/cli/mcp",
        "claims": ["mcp"]
      },
      {
        "id": "openclaw-plugin-conformance",
        "type": "conformance",
        "location": "adapters/openclaw/plugin/plugin.test.mjs",
        "claims": ["explicit_invocation", "invocation", "proposal_apply", "support"]
      },
      {
        "id": "openclaw-kernel",
        "type": "conformance",
        "location": "tests/test_contextos_kernel.py",
        "claims": ["proposal_apply"]
      },
      {
        "id": "openclaw-conformance",
        "type": "conformance",
        "location": "tests/test_openclaw_conformance.py",
        "claims": ["support", "skill_sources", "instruction_sources", "invocation"]
      }
    ]
  }
}
